{
  "contract": "avm-interoperability-evidence-1.0",
  "evidence_id": "replace-with-unique-evidence-id",
  "profile_id": "avm-industry-pilot-1.0",
  "generated_at_utc": "2026-08-01T12:00:00Z",
  "scope": "industry-pilot",
  "implementations": [],
  "vectors": [],
  "pilot_organizations": [],
  "approvals": []
}
